60236,Camus,3758,3870,,,Cerrado,12/12/2024,06/01/2025,,06/01/2025,06/01/2025,Panzer IV,Panzer IV,Santuario,Panzer IV,41932203,753711,72020.0,65,"INSPECCIONAR CON INSTRUMENTO 3D. UTILIZAR PROGRAMA DE INSPECCIÓN 3D Y PI 390-44552-403_MF.
REGISTRAR: EQUIPO UTILIZADO.................................................................
",9320.0,,,Goku,390-44552-403_MF,20-20,CARENADO,"Características 4-5-6-8 de PI 390-44552-403_MF REV / se encuentra fuera de tolerancia, se adjunta informe de medición.",GYD-015,,,,9320,CONTROL DE CALIDAD,20 - 20
60237,Shiryu,3758,3748,975.0,Métodos,Cerrado en Disposición,12/12/2024,16/12/2024,,,,Panzer IV,Panzer IV,Santuario,Panzer IV,41932104,755285,0.0,25,ENMASCARAR ZONA DE  CONTACTO A MASA S/ IOP/PRE/0255 E IPT/PRE/0139.,416.0,,,Goku,390-15776-403_MF,21-26,"SOPORTE, ARNES-DEL, AL",De acuerdo a pln de insp. 390-15776-403_MF REV / la ref. 5 se encuentra fuera de tolerancia en las piezas 1-3-5. Ver informes adjuntos en red. \\Srie04in1\\mediciones 3d\\SALA DE MMC - PAM\\MEDICIONES\\KC 390\\390-15776-403_MF\\390-15776-403_MF-OTP755285,GYD-015,,,,416,PROCESO QUIMÍCO,21 - 26
60238,Shaka,3758,210,975.0,Métodos,Cerrado,12/12/2024,17/12/2024,,18/12/2024,18/12/2024,Panzer IV,Panzer IV,Santuario,Panzer IV,41932104,754119,0.0,45,"INSPECCIONAR SEGUN PLAN DE INSPECCION.
",9320.0,,,Goku,390-44540-403_MF,20-20,"CUADERNA 32, IZQ, CONO DE COLA, AL","Las referencias 8, 10 y 11, del PI 390-44540-403_MF REV. B, se encuentran fuera de tolerancia.",AGU-009,,,,9320,CONTROL DE CALIDAD,20 - 20
60239,Aioros,3788,411,731.0,Materiales,Cerrado,12/12/2024,13/12/2024,,13/12/2024,13/12/2024,Panzer IV,Panzer IV,Santuario,Panzer IV,41933020,753235,390920.0,0,,,,,Goku,390-57310-410,20-20,SPOILER 1 DERECHO,"HINGE CENTRAL,LH-SPOILER1, AL 390-57321-403 mal identificada ( no se puede instalar en utillaje de armado de spoiler 1 izq pero si cumple para ser posicionado en spoiler 1 derecho",PIN-004,,,,411,PINTURA DE PARTES,20 - 20
60240,Aioros,3788,411,731.0,Materiales,Cerrado,12/12/2024,13/12/2024,,13/12/2024,13/12/2024,Panzer IV,Panzer IV,Santuario,Panzer IV,41933020,753235,390920.0,0,,,,,Goku,390-57310-410,20-20,SPOILER 1 DERECHO,"HINGE CENTRAL,RH-SPOILER1, AL 390-57321-404 mal identificada ( no se puede instalar en utillaje de armado de spoiler 1 der pero si cumple para ser posicionado en spoiler 1 izq)",PIN-004,,,,411,PINTURA DE PARTES,20 - 20
60241,Seiya,3768,413,,,Cerrado,12/12/2024,16/12/2024,,18/12/2024,18/12/2024,Panzer IV,Panzer IV,Santuario,Panzer IV,41932104,746028,10.0,75,"REALIZAR PROCESO DE SHOT PEENING A LA PIEZA (LADO 2) Y VERIFICACION FINAL CON PROBETA ALMEN S/NE40-072 (NPF/PAM/027, IOP/PRE/0284, IOP/PRE/0285).                                                                                                                                                                                                                         GRANALLA: CW-32                                                                                                                                                                                                                                                            INTENSIDAD ALMEN:  0.006A - 0.010A                                                                                                                                                                                                                                              RECETA: KC390-0014",416.0,,,Goku,390-47771-409_MF,17-17,"MONTANTE,TOPE,RAMPA, PTA CARGA,AL","Se observa en C/U 1 pieza,  un sector de 35 x35 mm aprox, una rugosidad de 8.95 Ra, esta rugosidad esta por encima de los valores requeridos en el IT que es como máximo 6.8 Ra.",PAM-011,41932804.0,757507.0,60241.0,416,PROCESO QUIMÍCO,17 - 17
60242,Seiya,3768,416,,,Cerrado,12/12/2024,16/12/2024,,18/12/2024,18/12/2024,Panzer IV,Panzer IV,Santuario,Panzer IV,41932105,752839,0.0,70,"REALIZAR PROCESO DE SHOT PEENING A LA PIEZA (LADO 2) Y VERIFICACION FINAL CON PROBETA ALMEN S/NE40-072 (NPF/PAM/027, IOP/PRE/0284, IOP/PRE/0285).                                                                                                                                                                                                                         GRANALLA: CW-32                                                                                                                                                                                                                                                            INTENSIDAD ALMEN:  0.006A - 0.010A                                                                                                                                                                                                                                              RECETA: 
KC390-0017 LADO 1
KC390-0018 LADO 2",416.0,,,Goku,390-57314-406_MF,19-19,"CHARNELA CENTRAL, DER-SPOILER 1","Se observa en un sector de la pieza de 35 x35 mm aprox, una rugosidad de 9.25 Ra, esta rugosidad esta por encima de los valores requeridos en el IT que es como máximo 6.8 Ra.",PAM-011,41932805.0,757508.0,60242.0,416,PROCESO QUIMÍCO,19 - 19
60243,Shaka,3758,203,,,Cerrado,12/12/2024,20/12/2024,,20/12/2024,20/12/2024,Panzer IV,Panzer IV,Santuario,Panzer IV,41932203,753698,72020.0,70,INSPECCIONAR  CON INSTRUMENTO 3D S. UTILIZAR PROGRAMA DE INSPECCIÓN 3D Y PI 390-44539-405_MF                                                                                                                                                                                                                                                                                          REGISTRAR:    EQUIPO UTILIZADO.................................................................,9320.0,,,Goku,390-44539-405_MF,20-20,RECUBRIMIENTO LATERAL IZQUIERDO,"Las referencias 5, 8, 9,10, 12, 13, 15 y 17, del PI 390-44539-405_MF REV A, se encuentran fuera de tolerancia.",AGU-009,,,,9320,CONTROL DE CALIDAD,20 - 20
60244,Shaka,3758,203,,,Cerrado,12/12/2024,13/12/2024,,08/01/2025,08/01/2025,Panzer IV,Panzer IV,Santuario,Panzer IV,41932203,753706,72020.0,65,INSPECCIONAR  CON INSTRUMENTO 3D. UTILIZAR PROGRAMA DE INSPECCIÓN 3D Y PI 390-44538-403.                                                                                                                                                                                                                                                                                          REGISTRAR:    EQUIPO UTILIZADO.................................................................,9320.0,,,Goku,390-44538-403_MF,20-20,RECUBRIMIENTO,"La referencia 6 del PI 390-44538-403_MF REV/, se encuentra fuera de tolerancia.",AGU-009,41932903.0,757424.0,60244.0,9320,CONTROL DE CALIDAD,20 - 20
60245,Poseidon,9451,9001,,,Datos básicos,13/12/2024,,,,,Sturmgeschütz III,Panther,Blue Graad,Panther,53102317,300019,0.0,0,,,,,Goku,T22AB5,S/D,AMORTIGUADOR,Se reclama certificado de fabricante (HUTCHINSON),LOG-010,,,,9001,,0 - 0
60246,Poseidon,9451,9001,,,Datos básicos,13/12/2024,,,,,Sturmgeschütz III,Panther,Blue Graad,Panther,53102317,300019,0.0,0,,,,,Goku,T22AB2,S/D,AMORTIGUADOR,"Se solicita T22AB5 y envían T22AB2.
Además, se reclama certificado de fabricante (BARRY CONTROLS)",LOG-001,,,,9001,,0 - 0
60247,Poseidon,9451,9001,,,Datos básicos,13/12/2024,,,,,Sturmgeschütz III,Panther,Blue Graad,Panther,53102317,300019,0.0,0,,,,,Goku,AM003-10,S/D,AMORTIGUADOR,Se reclama certificado de fabricante (LORD CORPORATION),LOG-010,,,,9001,,0 - 0
60248,Poseidon,9451,9001,,,Datos básicos,13/12/2024,,,,,Sturmgeschütz III,Panther,Blue Graad,Panther,53102317,300019,0.0,0,,,,,Goku,MS21437E231,S/D,INTERRUPTOR,Se reclama certificado de fabricante (SAFRAN),LOG-010,,,,9001,,0 - 0
60249,Poseidon,9451,9001,,,Datos básicos,13/12/2024,,,,,Sturmgeschütz III,Panther,Blue Graad,Panther,53102317,300019,0.0,0,,,,,Goku,MS3475W20-41SW,S/D,CONECTOR,"La OC pide MS3126E20-41SW y recibimos MS3475W20-41SW.
Además, se reclama certificado de fabricante (TE CONNECTIVITY)",LOG-001,,,,9001,,0 - 0
60250,Poseidon,9451,9001,,,Datos básicos,13/12/2024,,,,,Sturmgeschütz III,Panther,Blue Graad,Panther,53102317,300019,0.0,0,,,,,Goku,MS3475W20-41SX,S/D,CONECTOR,"La OC solicita MS3126E20-41SX y recibimos MS3475W20-41SX.
Además, se reclama certificado de fabricante (AERO ELECTRIC)",LOG-001,,,,9001,,0 - 0
60251,Poseidon,9451,9001,,,Datos básicos,13/12/2024,,,,,Sturmgeschütz III,Panther,Blue Graad,Panther,53102317,300019,0.0,0,,,,,Goku,MS3470W22-55S,S/D,CONECTOR,Se solicita certificado de fabricante (MATRIX),LOG-010,,,,9001,,0 - 0
60252,Poseidon,9451,9001,,,Datos básicos,13/12/2024,,,,,Sturmgeschütz III,Panther,Blue Graad,Panther,53102317,300019,0.0,0,,,,,Goku,M39012/20-0101,S/D,CONECTOR,Se solicita certificado de fabricante (DELTA ELECTRONICS).,LOG-010,,,,9001,,0 - 0
60253,Afrodita,3738,203,,,Anulado,13/12/2024,,,,,Panzer IV,Panzer IV,Santuario,Panzer IV,41932203,754074,72020.0,0,,,,,Goku,390-44539-406_MF,20-20,RECUBRIMIENTO LATERAL DERECHO,"La pieza RECUBRIMIENTO LATERAL DERECHO 390-44539-406_MF presenta: A- Durante la inspeccion por US se delimito una zona caracterizada como porosidad, ver END 262512. B- Se observa una chapa de metalizacion desplazada con respecto a c/u 2 perforaciones. C- En lado interno se observa desplazada la tira de fibra de vidrio con respecto a c/u 3 perforaciones.",COM-029,,,,203,MATERIAL COMPUESTO,20 - 20
60254,Afrodita,3738,203,,,Cerrado,13/12/2024,13/12/2024,,20/12/2024,20/12/2024,Panzer IV,Panzer IV,Santuario,Panzer IV,41932203,754074,72020.0,0,,,,,Goku,390-44539-406_MF,20-20,RECUBRIMIENTO LATERAL DERECHO,"La pieza RECUBRIMIENTO LATERAL DERECHO 390-44539-406_MF presenta: A- Durante la inspeccion por US se delimito una zona caracterizada como porosidad, ver END 262512. B- Se observa una chapa de metalizacion desplazada con respecto a c/u 2 perforaciones. C- En lado interno se observa desplazada la tira de fibra de vidrio con respecto a c/u 3 perforaciones.",COM-029,41932903.0,757425.0,60254.0,203,MATERIAL COMPUESTO,20 - 20
60255,Poseidon,9451,9001,,,Datos básicos,13/12/2024,,,,,Sturmgeschütz III,Panther,Blue Graad,Panther,53102317,300019,0.0,0,,,,,Goku,G9091-13NF,S/D,ADAPTADOR,Se solicita certificado de fabricante (AMPHENOL),LOG-010,,,,9001,,0 - 0
60256,Poseidon,9451,9001,,,Datos básicos,13/12/2024,,,,,Sturmgeschütz III,Panther,Blue Graad,Panther,53102317,300019,0.0,0,,,,,Goku,G9091-21NF,S/D,ADAPTADOR,Se solicita certificado de fabricante (AMPHENOL),LOG-010,,,,9001,,0 - 0
60257,Poseidon,9451,9001,,,Datos básicos,13/12/2024,,,,,Sturmgeschütz III,Panther,Blue Graad,Panther,53102317,300019,0.0,0,,,,,Goku,G9091-25NF,S/D,ADAPTADOR,Se solicita certificado de fabricante (AMPHENOL),LOG-010,,,,9001,,0 - 0
60258,Afrodita,3738,203,,,Cerrado,13/12/2024,13/12/2024,,20/12/2024,20/12/2024,Panzer IV,Panzer IV,Santuario,Panzer IV,41932203,753698,72020.0,0,,,,,Goku,390-44539-405_MF,20-20,RECUBRIMIENTO LATERAL IZQUIERDO,"La pieza RECUBRIMIENTO LATERAL IZQUIERDO 390-44539-405_MF presenta: A- Se realizo inspección por US y se delimito una zona caracterizada como porosidad, ver informe END 262527. B- En lado interno se observa una zona con aplastamiento del honeycomb flexible.",COM-029,41932903.0,757426.0,60258.0,203,MATERIAL COMPUESTO,20 - 20
60259,Poseidon,9451,9001,,,Datos básicos,13/12/2024,,,,,Sturmgeschütz III,Panther,Blue Graad,Panther,53102317,300019,0.0,0,,,,,Goku,222K142-25,S/D,BOTA TERMOCONTRAIBLE,Se solicita certificado de fabricante (TE CONNECTIVITY),LOG-010,,,,9001,,0 - 0
60260,Poseidon,9451,9001,,,Datos básicos,13/12/2024,,,,,Sturmgeschütz III,Panther,Blue Graad,Panther,53102317,300019,0.0,0,,,,,Goku,443HD007NF2308,S/D,PRENSA CABLE,Se solicita certificado de fabricante (GLENAIR),LOG-010,,,,9001,,0 - 0
60261,Kanon,3768,411,,,Anulado,13/12/2024,,,,,Panzer IV,Panzer IV,Santuario,Panzer IV,41933020,754417,390820.0,50,"APLICACIÓN DE LA PINTURA POLIURETÁNICA GRIS SEMI-BRILLANTE PN: 656-58-6293/X-503-(26293) (POS. 3) SEGÚN NE 40-274 (NPF/PIN/027).
                                                                                            NOTA 1: FILTRAR LA PINTURA ANTES DE SU APLICACIÓN. 	
NOTA 2: APLICAR SEGÚN IOP/PIN/0003.
NOTA 3: EL TIEMPO MÁXIMO PARA EVITAR LA REACTIVACIÓN DE LA SUPERFICIE ES DE 24 HORAS.          NOTA 4: ACOMPAÑAR TODAS LAS ETAPAS PROCESALES CON UNA PROBETA DE ALUMINIO 2024 T3 PARA REALIZAR LA MEDICIÓN DE ESPESOR. LAS PROBETAS CONFECCIONADAS DURANTE EL PROCESO DE PINTURA, DEBEN UBICARSE EN UNA ZONA REPRESENTATIVA DEL MISMO. IDENTIFICAR LAS PROBETAS CON NRO. DE NCOT Y PN DE LA PIEZA. VER IOP-PIN-0016.                                                                                    	
- PRESIÓN DE ATOMIZACIÓN (20-50 PSI)
- ESPESOR (50 A 75 µm)	                                                    
- TIEMPO ENTRE MANOS: 15-30MIN			
- SECADO: 8 HORAS A 25 ± 2 °C Y 55 ± 5 % HR, ASEGURARSE UN ADECUADO FLUJO DE AIRE ALREDEDOR DE LA PIEZA DENTRO DE LA CABINA DE SECADO.                                                                                    - SECADO ACELERADO: DEJAR LA MEZCLA UN TIEMPO DE INDUCCIÓN DE 30 MINUTOS. APLICAR PINTURA EN LA PIEZA S/LAS CONDICIONES DESCRIPTAS Y LUEGO SECAR 1 HORA A 24 °C Y POSTERIORMENTE 2 HORAS A 49 °C.            

COMPLETAR FORMULARIO IOP-PIN-0020-1                               
 SI LAS CONDICIONES DE SECADO NO SE PUEDEN CUMPLIR, NO REALIZAR LA OPERACIÓN. COMUNICAR LA NOVEDAD AL JEFE DEL ÁREA OPERATIVA Y A ING. DE PROCESOS.

",411.0,,,Goku,390-04164-403-903,20-20,CONJ. PINTADO CARENADO FLAP MOVIL 2,"Se observan sobre el conjunto ya pintado en OP 50 las siguientes observaciones :
1-  falta identificaciones OP 20 y 25 .
2-  Falta de pintura ( pintura saltada en proceso de  desenmmacarado ) en todo el contorno trasero del conjunto una zona de aprox. 5 mm de ancho por 1500 mm de largo . NOVEDAD MUY VISIBLE .
3-  Falta de pintura en 4 remaches en interior .
4- En una zona tapa central se filtro pintura sobre el plano del sellante , en el resto de las tapas hay pintura en los cantos de los sellantes . No apto según IPT -PIN -0507 pagina 11 .
5- Muy leves marcas en 2 remaches del lado pintado gris .
NOTA .    VER OBSERVACIONES INDICADOS EN EL CONJUNTO YA PINTADO .",PIN-006,,,,411,PINTURA DE PARTES,20 - 20
60262,Kanon,3768,411,,,Cerrado,13/12/2024,13/12/2024,,20/12/2024,20/12/2024,Panzer IV,Panzer IV,Santuario,Panzer IV,41933020,754417,390820.0,50,"APLICACIÓN DE LA PINTURA POLIURETÁNICA GRIS SEMI-BRILLANTE PN: 656-58-6293/X-503-(26293) (POS. 3) SEGÚN NE 40-274 (NPF/PIN/027).
                                                                                            NOTA 1: FILTRAR LA PINTURA ANTES DE SU APLICACIÓN. 	
NOTA 2: APLICAR SEGÚN IOP/PIN/0003.
NOTA 3: EL TIEMPO MÁXIMO PARA EVITAR LA REACTIVACIÓN DE LA SUPERFICIE ES DE 24 HORAS.          NOTA 4: ACOMPAÑAR TODAS LAS ETAPAS PROCESALES CON UNA PROBETA DE ALUMINIO 2024 T3 PARA REALIZAR LA MEDICIÓN DE ESPESOR. LAS PROBETAS CONFECCIONADAS DURANTE EL PROCESO DE PINTURA, DEBEN UBICARSE EN UNA ZONA REPRESENTATIVA DEL MISMO. IDENTIFICAR LAS PROBETAS CON NRO. DE NCOT Y PN DE LA PIEZA. VER IOP-PIN-0016.                                                                                    	
- PRESIÓN DE ATOMIZACIÓN (20-50 PSI)
- ESPESOR (50 A 75 µm)	                                                    
- TIEMPO ENTRE MANOS: 15-30MIN			
- SECADO: 8 HORAS A 25 ± 2 °C Y 55 ± 5 % HR, ASEGURARSE UN ADECUADO FLUJO DE AIRE ALREDEDOR DE LA PIEZA DENTRO DE LA CABINA DE SECADO.                                                                                    - SECADO ACELERADO: DEJAR LA MEZCLA UN TIEMPO DE INDUCCIÓN DE 30 MINUTOS. APLICAR PINTURA EN LA PIEZA S/LAS CONDICIONES DESCRIPTAS Y LUEGO SECAR 1 HORA A 24 °C Y POSTERIORMENTE 2 HORAS A 49 °C.            

COMPLETAR FORMULARIO IOP-PIN-0020-1                               
 SI LAS CONDICIONES DE SECADO NO SE PUEDEN CUMPLIR, NO REALIZAR LA OPERACIÓN. COMUNICAR LA NOVEDAD AL JEFE DEL ÁREA OPERATIVA Y A ING. DE PROCESOS.

",411.0,,,Goku,390-04164-403-903,20-20,CONJ. PINTADO CARENADO FLAP MOVIL 2,"Se observan sobre el conjunto ya pintado en OP 50 las siguientes observaciones :
1-  falta identificaciones OP 20 y 25 .
2-  Falta de pintura ( pintura saltada en proceso de  desenmmacarado ) en todo el contorno trasero del conjunto una zona de aprox. 5 mm de ancho por 1500 mm de largo . NOVEDAD MUY VISIBLE .
3-  Falta de pintura en 4 remaches en interior .
4- En una zona tapa central se filtro pintura sobre el plano del sellante , en el resto de las tapas hay pintura en los cantos de los sellantes . No apto según IPT -PIN -0507 pagina 11 .
5- Muy leves marcas en 2 remaches del lado pintado gris .
NOTA .    VER OBSERVACIONES INDICADOS EN EL CONJUNTO YA PINTADO .",PIN-006,41933820.0,757430.0,60262.0,411,PINTURA DE PARTES,20 - 20
60263,Poseidon,9451,9001,,,Datos básicos,13/12/2024,,,,,Sturmgeschütz III,Panther,Blue Graad,Panther,53102317,300019,0.0,0,,,,,Goku,D-500-0255-525-1,S/D,ACOPLADOR DATABUS,Se solicita certificado de fabricante (TE CONNECTIVITY),LOG-010,,,,9001,,0 - 0
60264,Milo,3738,206,,,Cerrado,13/12/2024,13/12/2024,,08/01/2025,08/01/2025,Panzer IV,Panzer IV,Santuario,Panzer IV,41932203,754079,72020.0,60,INSPECCIONAR VISUALMENTE SEGUN NE 20-032 (NPF/PRE/005) Y NE 07-009 (NPF/PRE/038).,3738.0,,,Goku,390-44534-404_MF,20,PANEL DE ACCESO,SEGUN PLAN DE INSPECCION CARACTERISTICA 6 FUERA DE TOLERANCIA.,GYD-015,41932903.0,757427.0,60264.0,3738,CONTROL DE CALIDAD,20 - 20
60265,Hyoga,3748,3748,,,Cerrado,13/12/2024,14/12/2024,,19/12/2024,19/12/2024,Panzer IV,Panzer IV,Santuario,Panzer IV,41932105,753760,0.0,90,"INSTALAR BUJES SEGUN IPT-PAM-0091 METODO VI E IPT-PAM-0388
REGISTRAR NCOT DE PREPARACION DEL SELLANTE SEGUN NPF-PIN-031-1 = ______________
",308.0,,,Goku,391-58670-402_MF,N/S,"BISAGRA,TRASERA,DER-NLG,AL",Los bujes instalados presentan marcas profundas en su diámetro interior con rugosidad superficial de 2.7µm.,AGU-001,41932805.0,757449.0,60265.0,308,MECANICA CONVENCIONAL,20 - 20
60266,Aioros,3788,3719,,,Vigente c/OTP,13/12/2024,13/12/2024,,,,Tiger I,Tiger I,Jamir,Tiger I,42100201,745273,0.0,0,,,PT 2020/100100,,Goku,100B--943340A02B,1-1,BONDING ALA ALERON 2 IZQ,BONDING ALA ALERON 2 IZQ 100B--943340A02B presenta fisura,ADE-011,42100281.0,757431.0,60266.0,3719,,1 - 1
60267,Seiya,3768,413,,,Vigente c/disposición de CRP/CRM,13/12/2024,16/12/2024,,,,Jagdpanther,Sturmgeschütz III,Asgard,Jagdpanther,44036700,753249,0.0,30,REALIZAR TRATAMIENTO TÉRMICO DE REVENIDO EN HORNO DE AIRE CIRCULANTE PARA OBTENER UNA DUREZA FINAL DE 35-40 HRC S/NPF/PRE/025 E IOP/PRE/0069.,413.0,,,Goku,175732211-PMA V1T6197-01-F-003-3,0-0,AGUANTADOR MATRIZ,Ingeniería de procesos determino la generación de IMNC en el QA22 5116 para dar scrap y generar repocicion de la pieza.,TTS-005,,,,413,TRATAMIENTO TERMICO,0 - 0
60268,Seiya,3768,413,,,Vigente c/OTP,13/12/2024,16/12/2024,,,,Panzer IV,Panzer IV,Santuario,Panzer IV,41936223,751780,0.0,30,"INSPECCIÓN DE DUREZA S/NPF/PRE/052 E IOP/PRE/0232, NPF/PRE/025 E IOP/PRE/069. VALOR REQUERIDO 36  - 40 HRC. REGISTRAR: N° MAYCO EQUIPO:………… VTO. CALIB.: ________ CANT.PIEZAS CONTROLADAS:……….NRO DE MEDICIONES……….VALOR MAX:………… VALOR MIN:………… MEDIA:………. S/D:…………",0.0,,,Goku,US-166-2-45-10-001,0-0,MANGO,Ingeniería de procesos determino la generación de IMNC en el QA22 5117 para dar scrap y generar reemision de la pieza.,TTS-005,41936755.0,757826.0,60268.0,413,TRATAMIENTO TERMICO,0 - 0
60269,Hyoga,3748,3748,975.0,Métodos,Cerrado en Disposición,13/12/2024,14/12/2024,,,,Panzer IV,Panzer IV,Santuario,Panzer IV,41932105,753759,0.0,85,"INSTALAR ROTULAS SEGUN IPT-PAM-0022.
REGISTRAR NCOT DE PREPARACION DEL SELLANTE: NPF-PIN-031-1 = ______________

TORQUE SIN CARGA PREVIO AL MONTAJE ( 0.028 - 0.904 Nm ) = ______________ Nm

CARGA DE INSTALACION ( NOMINAL 9.6 - MAXIMO 10.6 Tn ) = ______________ Tn

TORQUE SIN CARGA POSTERIOR AL MONTAJE ( 0.028 - 1.808 Nm ) = ______________ Nm",308.0,,,Goku,390-16809-404_MF,N/S,"CHARNELA, DELANTERA PUERTA, DER",El torque sin carga posterior al montaje da 0.01 bajo medida y fuera de tolerancia.,ADE-012,,,,308,MECANICA CONVENCIONAL,20 - 20
60270,Seiya,3768,9725,,,Cerrado en Disposición,13/12/2024,16/12/2024,,,,Panzer IV,Panzer IV,Santuario,Panzer IV,41932104,754870,10.0,40,"PERFILAR EN FRÍO EN CONDICION "" W ""DENTRO DE LOS 10 MIN DE HABER RETIRADO LA PIEZA DE LA CÁMARA FROGORÍFICA DE ACUERDO CON NE03-076 E IOP/PAM/0002  . VER IPT/PAM/0392
REGISTRAR: (TIEMPO TRANSCURRIDO ENTRE EL RETIRO DE LA PIEZA DE LA CAMARA FRIGORIFICA Y EL CONFORMADO .................. )

NOTA:
EN CASO DE PIEZAS CON OREJAS O SOBREMATERIAL
CORTAR SEGÚN LO INDICADO CON LINEAS DE TRAZOS EN IPT/PAM/0392.
RETIRAR EL EXCESO DE CONTORNO Y REBABAR DE ACUERDO CON NE03-051 (NPF/PAM/008)
CALIBRAR SEGÚN NECESIDAD S/IOP/PAM/0004.
LIMPIAR EL MATERIAL DE ACUERDO CON NE40-012. (NPF/PRE/029 E IOP/PRE/0054
",404.0,,,Goku,390-12406-403_MF,25-27,"PERFIL OMEGA, BAHIA ELEC. 2","Se observa que la cota de REF 18 152 +/-0.8 mm del PI, en las tres piezas mide 153.4/153.5 mm.",GYD-004,,,,404,CHAPA,25 - 27
60271,Shun,3748,3748,,,Cerrado,14/12/2024,14/12/2024,,17/12/2024,17/12/2024,Tiger I,Tiger I,Jamir,Tiger I,42100204,744796,15.0,60,"INSPECCIONAR ASPECTO VISUAL, DIMENSIONES, ROSCAS, RUGOSIDAD E IDENTIFICACION SEGUN PLANO.",3748.0,PT 2020/100100,,Goku,100B--241900A06B,1-1,PASADOR EJE,"La pieza presenta perforación de 2 mm a 4.5 mm del borde y el plano pide a 10,2.
La rosca exterior se encuentra en mayor medida. Una de las roscas interiores presenta rebabas.
Se observan resaltos con radios ceros en distintos sectores de la misma.",AGU-009,42100284.0,757450.0,60271.0,3748,VARIOS - (ANULAR DESPUES DE ACT.TABLA TALLERES),1 - 1
60272,Kanon,3768,411,,,Cerrado,14/12/2024,20/12/2024,,30/12/2024,30/12/2024,Panzer IV,Panzer IV,Santuario,Panzer IV,41933020,754419,390820.0,45,"ANTES DE APLICAR PINTURA POLIURETÁNICA GRIS SEMI-BRILLANTE EN LAS TAPAS, PINTAR LOS AVELLANADOS CON PRIMER BAC 452 TIPO II PN: 17084 GEP-LVOC/17085CEH-LVOC/ NE 40-143 (NPF/PIN/023).",411.0,,,Goku,390-04166-403-903,20-20,CONJ. PINTADO CARENADO FLAP MOVIL 4,"El conjunto presenta un golpe que provoco  la rotura de material compuesto de aprox. 80 mm de largo .
Ver observación indicado en el conjunto .",PAM-010,41933820.0,757760.0,60272.0,411,PINTURA DE PARTES,20 - 20
60273,Camus,3758,3870,,,Cerrado,14/12/2024,16/12/2024,,16/12/2024,16/12/2024,Panzer IV,Panzer IV,Santuario,Panzer IV,41932203,753633,52017.0,70,INSPECCIONAR  CON INSTRUMENTO 3D. UTILIZAR PROGRAMA DE INSPECCIÓN 3D  Y  PI 390-56947-401_MF.                                                                                                                                                                                                                                                                                          REGISTRAR:    EQUIPO UTILIZADO.................................................................,9320.0,,,Goku,390-56947-403_MF,19-19,CARENADO DE FLAP FIJO # 3 IZQ. TIP,Características 1-2 de PI 390-56847-401_MF REV / se encuentra fuera de tolerancia; se adjunta informe de medición.,GYD-015,,,,9320,CONTROL DE CALIDAD,19 - 19
60274,Camus,3758,3870,,,Cerrado,14/12/2024,16/12/2024,,17/12/2024,17/12/2024,Panzer IV,Panzer IV,Santuario,Panzer IV,41932203,753636,52017.0,70,INSPECCIONAR  CON INSTRUMENTO. UTILIZAR PROGRAMA DE INSPECCIÓN 3D  Y  PI 390-56947-402_MF.                                                                                                                                                                                                                                                                                          REGISTRAR:    EQUIPO UTILIZADO.................................................................,9320.0,,,Goku,390-56947-404_MF,19-19,CARENADO DE FLAP FIJO # 3 DER. TIP,"Características 2-3 de PI 390-56947-404_MF REV A se encuentra fuera de tolerancia, se adjunta informe de medición.",GYD-015,,,,9320,CONTROL DE CALIDAD,19 - 19
60275,Seiya,3768,3748,742.0,Herramientas/Maq.,Cerrado en Disposición,14/12/2024,17/12/2024,,,,Panzer IV,Panzer IV,Santuario,Panzer IV,41932105,752247,0.0,30,"REBABAR COMPLETO, MATAR CANTOS VIVOS, BORRAR MARCAS DE HERRAMIENTA SEGUN IPT-PAM-0082.
PROCESAR POR TAMBOR VIBRATORIO SEGUN IPT-PAM-0766.
",301.0,,,Goku,390-57291-001_MF,21-26,"COSTILLA,CARENA MOVIL 3,FLAP-IZQ","Se observa que las cotas de REF  9 se encuentran fuera de tolerancia para las piezas N 2 , 3 y 5. según planes de inspección adjunto.",AGU-009,,,,301,MECANICA CONVENCIONAL,21 - 26
60276,Seiya,3768,3748,975.0,Métodos,Cerrado en Disposición,14/12/2024,16/12/2024,,,,Panzer IV,Panzer IV,Santuario,Panzer IV,41932104,750235,0.0,30,"REBABAR COMPLETO, MATAR CANTOS VIVOS, BORRAR MARCAS DE HERRAMIENTA SEGUN IPT-PAM-0082.
PROCESAR POR TAMBOR VIBRATORIO SEGUN IPT-PAM-0766.
",301.0,,,Goku,390-47435-001,18-20,"SPLICE,SEAL","Se observa que la cota de referencia 10 1.6 +/- .2 mm, se encuentra en C/U 4 piezas en 2 mm, quedando estas fuera de tolerancia.",GYD-006,,,,301,MECANICA CONVENCIONAL,18 - 20
60277,Hyoga,3748,3748,,,Cerrado,14/12/2024,16/12/2024,,18/12/2024,18/12/2024,Panzer IV,Panzer IV,Santuario,Panzer IV,41932105,753776,0.0,90,"INSTALAR BUJES SEGUN IPT-PAM-0091 METODO VI E IPT-PAM-0389
REGISTRAR NCOT DE PREPARACION DEL SELLANTE SEGUN NPF-PIN-031-1 = ______________
",308.0,,,Goku,391-58672-402_MF,N/S,"BISAGRA,TRASERA,DER-NLG,AL",Los bujes instalados presentan marcas profundas en su diámetro interior con rugosidad superficial de 2.41µm.,PAM-005,41932805.0,757457.0,60277.0,308,MECANICA CONVENCIONAL,19 - 19
