60278,Hyoga,3748,3748,975.0,Métodos,Cerrado,14/12/2024,16/12/2024,,18/12/2024,18/12/2024,Panzer IV,Panzer IV,Santuario,Panzer IV,41932805,756057,60069.0,10,"MECANIZAR EN FRESA CNC SEGUN PROGRAMAS, INSTRUCTIVO Y CROQUIS.

REGISTRAR DIAMETRO ESCARIADO 9.525 H7 MIN = __________ MAX = __________ MM

REGISTRAR DIAMETRO ESCARIADO 12.7 H7 MIN = __________ MAX = __________ MM
.",310.0,PT 2019/419361,,Goku,390-57715-402_MF,N/S,"HINGE LATERAL 1,RH",Presenta entrada de herramienta sobre una de las aletas posteriores de 2(±0.2) mm en sector aledaño al radio quedando el espesor en dicho sector en 1.67 mm,PAM-003,41932805.0,757509.0,60278.0,310,CONTROL NUMÉRICO,19 - 19
60279,Aioros,3788,3719,,,Vigente c/OTP,14/12/2024,16/12/2024,,,,Tiger I,Tiger I,Jamir,Tiger I,42100201,745781,0.0,0,,,PT 2020/100100,,Goku,100B--120460A00C,1-1,SOPORTE ALERON 3,Perforaciones de SOPORTE ALERON 3  100B-120460A00C no coincidentes con los TOMA ALERON A3 100B-120660A00C,AGU-009,42100282.0,757500.0,60279.0,3719,,1 - 1
60280,Aioros,3788,3719,,,Vigente c/OTP,14/12/2024,16/12/2024,,,,Tiger I,Tiger I,Jamir,Tiger I,42100201,745781,0.0,0,,,PT 2020/100100,,Goku,100B--120450A00C,1-1,SOPORTE ALERON 2,Perforaciones de SOPORTE ALERON 2 100B--120450A00C abandonadas próximas a las de fijación de TOMA ALERON A2 100B--120650A00C,AGU-004,42100282.0,757501.0,60280.0,3719,,1 - 1
60281,Shaka,3758,203,,,Cerrado,16/12/2024,16/12/2024,,17/12/2024,17/12/2024,Panzer IV,Panzer IV,Santuario,Panzer IV,41932203,753632,52017.0,75,"INSPECCIONAR  CON INSTRUMENTO 3D. UTILIZAR PROGRAMA DE INSPECCIÓN 3D  Y  PI 390-57298-401_MF.                                                                                                                                          REGISTRAR:    EQUIPO UTILIZADO.................................................................                                                                                                                          

",9320.0,,,Goku,390-57298-403_MF,19-19,CARENADO DE FLAP FIJO # 2 IZQ. TIP,"Las referencias 5 y 6 del PI 390-57298-403_MF REV. /, se encuentran fuera de tolerancia.",AGU-009,,,,9320,CONTROL DE CALIDAD,19 - 19
60282,Milo,3738,1222,,,Vigente c/OTP,16/12/2024,17/12/2024,,,,Tiger I,Tiger I,Jamir,Tiger I,42100201,745781,0.0,5,POSICIONADO DE RECUBRIMIENTO INTRADOS (POS. 27) EN UTILLAJE UTILIZANDO LOS AGUJEROS DE COORDINACION.,222.0,PT 2020/100100,,Goku,100B--120000A00U,1,ALA DER. PRE-EQUIPADA,"PIEZA P/ N 100B-110850A05B,PREPERFORADO FUERA DE TOLERANCIA CON RESPECTO A CONTORNO.",GYD-003,42100281.0,757829.0,60282.0,222,,1 - 1
60283,Hades,3979,3870,,,Cerrado,16/12/2024,16/12/2024,,19/12/2024,19/12/2024,Panzer IV,Panzer IV,Santuario,Panzer IV,41933022,753229,390622.0,0,,,,,Goku,395-05400-431,22,CONJUNTO RACK DE ELECTRONICA (SUP),"Soporte, arnés P/N 390-15811-001 ,montado fue fabricado a riesgo con un material alternativo, el cual no fue autorizado según la Nota CD 203174379""",CYD-001,41933822.0,757498.0,60283.0,3870,ARMADO,22 - 22
60284,Shiryu,3758,3748,975.0,Métodos,Cerrado en Disposición,16/12/2024,16/12/2024,,,,Panzer IV,Panzer IV,Santuario,Panzer IV,41932105,752846,0.0,40,INSPECCIONAR SEGÚN PLAN DE INSPECCIÓN,9320.0,,,Goku,390-57614-405_MF,19-19,"CHARNELA CENTRAL,IZQ-SPOILER 4",De acuerdo a plan de insp. 390-57614-405_MF REV A la ref. 16 se encuentra fuera de tolerancia. Ver informe adjunto en red. \\Srie04in1\\mediciones 3d\\SALA DE MMC - PAM\\MEDICIONES\\KC 390\\390-57614-405_MF\\390-57614-405_MF_OTP752846_op40,GYD-015,,,,9320,CONTROL DE CALIDAD,19 - 19
60285,Seiya,3768,9725,,,Cerrado,16/12/2024,16/12/2024,,10/01/2025,10/01/2025,Panzer IV,Panzer IV,Santuario,Panzer IV,41932105,750714,0.0,40,"INSPECCIONAR POR LIQUIDOS PENETRANTES SEGUN NE07-001 (NPF/END/003 E IOP/END/0001).

ENSAYO N°: ______________",6214.0,,,Goku,390-47455-002_MF,19-19,LARGUERILLO 05 DERECHO,"Segun ensayo END-3737-24 se informa no conforme, persiste la corrocion en zonas indicadas, no conforme con criterio de NPF/END/003",PAM-002,41932805.0,757827.0,60285.0,6214,ENSAYO NO DESTRUCTIVO,19 - 19
60286,Aioros,3788,205,,,Vigente c/OTP,16/12/2024,17/12/2024,,,,Panzer IV,Panzer IV,Santuario,Panzer IV,41933020,754392,390120.0,0,,,,,Goku,391-58682-403,20-20,"PUERTA POSTERIOR, LH, CJTO NLGD","BISAGRA,TRASERA,IZQ-NLG,AL 391-58675-401 presenta marcas de herramienta",ADE-011,41933820.0,757502.0,60286.0,205,MECANICA CONVENCIONAL,20 - 20
60287,Camus,3758,3870,,,Cerrado,16/12/2024,17/12/2024,,08/01/2025,08/01/2025,Panzer IV,Panzer IV,Santuario,Panzer IV,41932203,753707,72020.0,65,INSPECCIONAR  CON INSTRUMENTO 3D. UTILIZAR PROGRAMA DE INSPECCIÓN 3D Y PI 390-44538-404.                                                                                                                                                                                                                                                                                          REGISTRAR:    EQUIPO UTILIZADO.................................................................,9320.0,,,Goku,390-44538-404_MF,20-20,RECUBRIMIENTO,"Características 4-6 de PI 390-44538-404_MF REV / se encuentra fuera de tolerancia, se adjunta informe de medición.",GYD-015,41932903.0,757828.0,60287.0,9320,CONTROL DE CALIDAD,20 - 20
60288,Camus,3758,3870,,,Cerrado,16/12/2024,17/12/2024,,07/01/2025,07/01/2025,Panzer IV,Panzer IV,Santuario,Panzer IV,41932203,753712,72020.0,75,INSPECCIONAR  CON INSTRUMENTO 3D. UTILIZAR PROGRAMA DE INSPECCIÓN 3D Y PI 390-44534-403_MF.                                                                                                                                                                                                                                                                                          REGISTRAR:    EQUIPO UTILIZADO.................................................................,9320.0,,,Goku,390-44534-403_MF,20-20,PANEL DE ACCESO,"Característica 6 de PI 390-44534-403_MF REV / se encuentra fuera de tolerancia, se adjunta informe de medición.",GYD-015,,,,9320,CONTROL DE CALIDAD,20 - 20
60289,Poseidon,9451,9001,,,Cerrado en Disposición,17/12/2024,17/12/2024,,,,Sturmgeschütz III,Panther,Blue Graad,Panther,53102317,300020,0.0,0,,,,,Goku,FA18635,S/D,BALLENA,"Novedades detectadas en los ensayos (dimensional y diagrama de cargas).
Req 261555",LOG-001,,,,9001,,0 - 0
60290,Poseidon,9451,9001,,,Cerrado en Disposición,17/12/2024,17/12/2024,,,,Sturmgeschütz III,Panther,Blue Graad,Panther,53102317,300020,0.0,0,,,,,Goku,AE649-4160,S/D,RESORTE,"Novedades varias detectadas durante los ensayos de recepción (dimensional y diagrama de cargas).
REQ 261557",LOG-001,,,,9001,,0 - 0
60291,Shaka,3758,3870,,,Cerrado en Disposición,17/12/2024,,,,,Panzer IV,Panzer IV,Santuario,Panzer IV,41933020,753227,390920.0,70,"INSPECCION DIMENSIONAL DE ACUERDO A:
PI 390-57310-409 PI rev / 

REGISTRAR NUMERO DE ID DEL EQUIPO DE MEDICION.........................................................

REGISTRAR FECHA DE VENCIMIENTO DE LA CALIBRACION .........................................................

",0.0,,,Goku,390-57310-409,20-20,SPOILER 1 IZQUIERDO,"La referencia 7 (tolerancia de forma de superficie extradós), del PI 390-57310-409 REV./, se encuentra fuera de tolerancia.",GYD-015,,,,3870,ARMADO,20 - 20
60292,Shaka,3758,3870,,,Cerrado en Disposición,17/12/2024,,,,,Panzer IV,Panzer IV,Santuario,Panzer IV,41933020,753235,390920.0,70,"INSPECCION DIMENSIONAL DE ACUERDO A:
PI 390-57310-410 PI rev / 

REGISTRAR NUMERO DE ID DEL EQUIPO DE MEDICION.........................................................

REGISTRAR FECHA DE VENCIMIENTO DE LA CALIBRACION .........................................................

",0.0,,,Goku,390-57310-410,20-20,SPOILER 1 DERECHO,"La referencia 7(tolerancia de forma de superficie extradós) del PI 390-57310-410 REV./, se encuentra fuera de tolerancia.",GYD-015,,,,3870,ARMADO,20 - 20
60293,Kraken Isaak,9451,9001,,,Datos básicos,17/12/2024,,,,,Sturmgeschütz III,Panther,Blue Graad,Panther,53102317,300019,0.0,0,,,,,Goku,A848KH,CW-89979 - 83,CONTACTOR,CAL. Falta Certificación S/N CW-89979 a CW-89983,LOG-005,,,,9001,,0 - 0
60294,Poseidon,9451,9001,,,Cerrado en Disposición,17/12/2024,,,,,Sturmgeschütz III,Panther,Blue Graad,Panther,53102317,300019,0.0,0,,,,,Goku,MS27754-34M,S/D,INTERRUPTOR,Se recibe sin certificado de fabricante (HONEYWELL).,LOG-010,,,,9001,,0 - 0
60295,Kraken Isaak,9451,9001,,,Datos básicos,17/12/2024,,,,,Sturmgeschütz III,Panther,Blue Graad,Panther,53102317,300020,0.0,0,,,,,Goku,,,NITROGENO LIQUIDO A GRANEL,LOG - El saldo no es suficiente para ingresar la totalidad recibida. Reclamado via mail 11/11,LOG-001,,,,9001,,0 - 0
60296,Kraken Isaak,9451,9001,,,Datos básicos,17/12/2024,,,,,Sturmgeschütz III,Panther,Blue Graad,Panther,53102317,300019,0.0,0,,,,,Goku,"PIA-W-5625D (9/16""-17925)",,"CINTA TUBULAR DE NYLON, BLANCA","LOG - No coincide PN recibido con solicitado en oc. Se recibe PN: PIA-W-5625-C1-9/16"", oc solicita PIA-W-5625D (9/16""-17925). LIM 261484",LOG-001,,,,9001,,0 - 0
60297,Kraken Isaak,9451,9001,,,Datos básicos,17/12/2024,,,,,Sturmgeschütz III,Panther,Blue Graad,Panther,53102317,300013,0.0,0,,,,,Goku,SSP550-45,,PLANCHA DE GOMA SILICONADA CONDUCTI,"LOG - Se recibe PN: R-FLS-121141, no coincide con lo solicitado en oc. CAL, Falta Certificación Lote: EH026 y EG025.",LOG-001,,,,9001,,0 - 0
60298,Camus,3758,3870,,,Cerrado,17/12/2024,18/12/2024,,18/12/2024,18/12/2024,Panzer IV,Panzer IV,Santuario,Panzer IV,41932203,753546,82019.0,215,"INSPECCIONAR  CON INSTRUMENTO 3D. UTILIZAR PROGRAMA DE INSPECCIÓN 3D  Y  PI 390-57812-403_MF.                                                                                                                                                                                                                                                                                          REGISTRAR:    EQUIPO UTILIZADO.................................................................                                                                                                                                                                                                                                                                                                                                                                                                                                                                                                                                  
/",9320.0,,,Goku,390-57812-403_MF,19-19,PANEL DE SPOILER 6 IZQ,"Característica 3 de PI 390-57812-403 REV A se encuentra fuera de tolerancia, se adjunta informe de medición.",GYD-015,41932903.0,757572.0,60298.0,9320,CONTROL DE CALIDAD,19 - 19
60299,Aioros,3788,9160,,,Cerrado,18/12/2024,07/01/2025,,07/01/2025,07/01/2025,Panzer IV,Panzer IV,Santuario,Panzer IV,41933020,753235,390920.0,0,,,,,Goku,390-57310-410,20-20,SPOILER 1 DERECHO,"HINGE CENTRAL 390-573121-404 Y HINGE LATERAL 2 RH 390-57316-402, según IPT solicita PE21101-4-54 y se instalo PE21101-4-55 C/U 6 por falta de Stock,",CYD-001,,,,9160,,20 - 20
60300,Aioros,3788,9160,,,Cerrado,18/12/2024,07/01/2025,,07/01/2025,07/01/2025,Panzer IV,Panzer IV,Santuario,Panzer IV,41933020,753227,390920.0,0,,,,,Goku,390-57310-409,20-20,SPOILER 1 IZQUIERDO,"HINGE CENTRAL 390-573121-403 Y HINGE LATERAL 2 LH 390-57316-401, según IPT solicita PE21101-4-54 y se instalo PE21101-4-55 CU 6 por falta de Stock,",CYD-001,,,,9160,,20 - 20
60301,Aioros,3788,3870,,,Cerrado,18/12/2024,19/12/2024,,19/12/2024,19/12/2024,Panzer IV,Panzer IV,Santuario,Panzer IV,41933020,753235,390920.0,0,,,,,Goku,390-57310-410,20-20,SPOILER 1 DERECHO,PANEL DE SPOLER 390-57312-404 excesivo avellanado para instalar tornillo PE21101-4,AGU-005,41933820.0,757670.0,60301.0,3870,ARMADO,20 - 20
60302,Mu,3758,3748,975.0,Métodos,Cerrado en Disposición,18/12/2024,19/12/2024,,,,Panzer IV,Panzer IV,Santuario,Panzer IV,41932105,755235,0.0,45,INSPECCIONAR SEGÚN PLAN DE INSPECCIÓN.,9320.0,,,Goku,390-05451-403_MF,23-23,"SUBCONJ-SOPORTE, INTERFACE, RACK",La Referencia 9 de PI se encuentra fuera de tolerancia. Informe adjunto,GYD-015,,,,9320,CONTROL DE CALIDAD,23 - 23
60303,Afrodita,3738,203,,,Vigente c/OTP,18/12/2024,18/12/2024,,,,Panzer IV,Panzer IV,Santuario,Panzer IV,41932203,753557,82019.0,0,,,,,Goku,390-57612-404_MF,19-19,PANEL DE SPOILER 4 DER,"Se realizo inspeccion por US y se delimito una zona caracterizada como inclusion, ver END 262792 adjunto.",COM-018,41932903.0,757654.0,60303.0,203,MATERIAL COMPUESTO,19 - 19
60304,Shun,3748,3748,,,Vigente c/OTP,18/12/2024,18/12/2024,,,,Tiger I,Tiger I,Jamir,Tiger I,42100284,756102,60014.0,25,"INSPECCIONAR ASPECTO VISUAL, DIMENSIONES E IDENTIFICACION SEGUN PLANO.",3748.0,PT 2020/100100,,Goku,100B--531000A05B,0-0,PERNO FIJACION DE TREN,"Se tenia que retrabajar una rosca a presión (solicitado en QA22: 5156), la cual se realizo a lima quedando deformada y bajo medida.",PAM-009,42100284.0,757689.0,60304.0,3748,VARIOS - (ANULAR DESPUES DE ACT.TABLA TALLERES),0 - 0
60305,Athena,3768,3870,,,Cerrado,18/12/2024,19/12/2024,,20/12/2024,20/12/2024,Panzer IV,Panzer IV,Santuario,Panzer IV,41933020,754163,390820.0,135,"PROCEDER CONTROL DIMENSIONAL SEGÚN PI 390-57234-409

REGISTRAR

PN DEL INSTRUMENTO:

FECHA DE VENCIMIENTO:",0.0,,,Goku,390-57234-411,20-20,CARENADO DE FLAP #4 MOV.,"Característica 8 de PI 390-57234-409 REV / se encuentra fuera de tolerancia, se adjunta informe de medición.",GYD-015,41933820.0,757660.0,60305.0,3870,ARMADO,20 - 20
60306,Seiya,3768,403,,,Vigente c/OTP,19/12/2024,19/12/2024,,,,Panzer IV,Panzer IV,Santuario,Panzer IV,41932105,756911,15.0,35,"PERFILAR EN FRÍO DE ACUERDO CON NE03-076 . VER IPT/PAM/0356, CALIBRAR SEGUN NECESIDAD
",404.0,,,Goku,PE12030-1T,21-21,PERFIL,Se observa que ambas pestañas de las piezas estan fuera de tolerancia segun REF 7 ( pide 18 +/- 0.8 mm y miden las piezas 16 mm)  y 8 ( pide 24.7 +/- 0.8 mm y miden las piezas 27.5 mm ) del PI.,GYD-004,41932805.0,757671.0,60306.0,404,CHAPA,21 - 21
60307,Shun,3748,3748,975.0,Métodos,Vigente c/OTP,19/12/2024,19/12/2024,,,,Panzer IV,Panzer IV,Santuario,Panzer IV,41932105,752632,0.0,55,INSPECCIONAR SEGÚN PLAN DE INSPECCIÓN.,3748.0,,,Goku,390-47502-003_MF,20-20,CUADERNA 2 SUB,"La pieza presenta referencias 6, 12, 13, 15 y 18  fuera de tolerancia. Se adjunta informe.
Espesores de pared de 3 mm se encuentran en 2.65 mm y espesor de 1.6 en 1.35 mm (ubicada sobre linea de forma, en un extremo).",GYD-007,41932805.0,757677.0,60307.0,3748,VARIOS - (ANULAR DESPUES DE ACT.TABLA TALLERES),20 - 20
60308,Thanatos,3738,801,,,Cerrado,19/12/2024,19/12/2024,,19/12/2024,19/12/2024,Hetzer,Marder III,Atlantis,Hetzer,42762500,736075,0.0,0,,,PT 2022/147602,,Goku,AE622-5000MIRPS,,BRIDA DE PILOTIN,"PLOMADA N/P N° AE622-5021MIRPS SE ENCUENTRA FUERA DE TOLERANCIA CON MAYOR PESO, PLANO SOLICITA 142 gr +/-14,2 gr Y TIENE 210gr.-",GYD-006,42762590.0,757679.0,60308.0,801,PARACAIDAS,0 - 0
60309,Thanatos,3738,801,,,Cerrado,19/12/2024,19/12/2024,,19/12/2024,19/12/2024,Hetzer,Marder III,Atlantis,Hetzer,42762500,736076,0.0,0,,,PT 2022/147602,,Goku,AE622-5000MIRPS,,BRIDA DE PILOTIN,"PLOMADA N/P N° AE622-5021MIRPS SE ENCUENTRA FUERA DE TOLERANCIA CON MAYOR PESO, PLANO SOLICITA 142 gr +/- 14,2gr Y TIENE 210gr.-",GYD-006,42762590.0,757678.0,60309.0,801,PARACAIDAS,0 - 0
60310,Shun,3748,3748,975.0,Métodos,Vigente c/disposición de CRP/CRM,19/12/2024,20/12/2024,,,,Panzer IV,Panzer IV,Santuario,Panzer IV,41932105,752603,0.0,45,INSPECCIONAR SEGÚN PLAN DE INSPECCIÓN.,9320.0,,,Goku,390-47508-003_MF,20-20,"CUADERNA 25,GANCHO 08, PTA CARGA,AL","La pieza presenta discrepancias en las referencias 8,17,18, 19 y 21 del plan de inspección. Ver informe adjunto.",GYD-015,,,,9320,CONTROL DE CALIDAD,20 - 20
60311,Afrodita,3738,203,,,Cerrado,19/12/2024,07/01/2025,,08/01/2025,08/01/2025,Panzer IV,Panzer IV,Santuario,Panzer IV,41932203,753531,82019.0,0,,,,,Goku,390-57312-403_MF,19-19,PANEL DE SPOILER,La pieza PANEL DE SPOILER 390-57312-403_MF presenta: A- Falta y excesiva porosidad de foam. B- Varias celdas sin densificar.,COM-026,,,,203,MATERIAL COMPUESTO,19 - 19
60312,Afrodita,3738,203,,,Cerrado,19/12/2024,07/01/2025,,08/01/2025,08/01/2025,Panzer IV,Panzer IV,Santuario,Panzer IV,41932203,753548,82019.0,0,,,,,Goku,390-57312-404_MF,19-19,PANEL DE SPOILER,La pieza PANEL DE SPOILER 390-57312-404_MF presenta. A- Falta y excesiva porosidad del foam. B- Celdas imcompletas de densificar y epocast con exceso de porosidad (Hervido).,COM-026,41932903.0,758339.0,60312.0,203,MATERIAL COMPUESTO,19 - 19
60313,Shaka,3758,3870,,,Cerrado en Disposición,19/12/2024,20/12/2024,,,,Panzer IV,Panzer IV,Santuario,Panzer IV,41933020,753231,390920.0,50,"INSPECCION DIMENSIONAL DE ACUERDO A:
PI 390-57610-409 PI rev /  SEGUN OP 050 DE IPT

REGISTRAR NUMERO DE ID DEL EQUIPO DE MEDICION.........................................................

REGISTRAR FECHA DE VENCIMIENTO DE LA CALIBRACION .........................................................

",0.0,,,Goku,390-57610-409,20-20,SPOILER 4 IZQUIERDO,"La referencia 7 (tolerancia de forma de superficie extradós) del PI 390-57610-409 REV/, se encuentra fuera de tolerancia.",GYD-015,,,,3870,ARMADO,20 - 20
60314,Shaka,3758,3870,,,Cerrado,19/12/2024,20/12/2024,,20/12/2024,20/12/2024,Panzer IV,Panzer IV,Santuario,Panzer IV,41933020,753237,390920.0,50,"- INSPECCION DIMENSIONAL DE ACUERDO A:
PI 390-57510-410 PI Y S/OP50 DE IPT

REGISTRAR NUMERO DE ID DEL EQUIPO DE MEDICION.........................................................

REGISTRAR FECHA DE VENCIMIENTO DE LA CALIBRACION .........................................................",0.0,,,Goku,390-57510-410,20-20,SPOILER 3 DERECHO,"La referencia 7 (tolerancia de forma de superficie extradós) del PI 390-57510-410 REV /, se encuentra fuera de tolerancia.",GYD-015,41933820.0,757691.0,60314.0,3870,ARMADO,20 - 20
60315,Hyoga,3748,3748,312.0,Métodos,Cerrado en Disposición,19/12/2024,20/12/2024,,,,Panzer IV,Panzer IV,Santuario,Panzer IV,41932105,756202,0.0,10,"MECANIZAR EN FRESA CNC SEGUN PROGRAMAS, INSTRUCTIVO Y CROQUIS.

REGISTRAR DIAMETRO ESCARIADO 9.525 H7 MIN = __________ MAX = __________ MM

REGISTRAR DIAMETRO ESCARIADO 12.7 H7 MIN = __________ MAX = __________ MM
.
",310.0,,,Goku,390-57415-401_MF,N/S,"HINGE LATERAL 1,LH","La pieza presentaba entrada de herramienta en aleta posterior, se suavizo y el espesor está bajo medida y fuera de tolerancia, tiene 1.70 mm en sector aledaño al radio..",PAM-003,,,,310,CONTROL NUMÉRICO,22 - 22
60316,Hyoga,3748,3748,742.0,M. de Obra Taller,Anulado,19/12/2024,,,,,Panzer IV,Panzer IV,Santuario,Panzer IV,41932104,751438,0.0,10,"INSPECCIÓN DE DUREZA S/NE 10-001 (NPF/PRE/052 E IOP/PRE/0232).
VALOR REQUERIDO 34 - 42 HRC. REGISTRAR: N° MAYCO EQUIPO:………… DUREZA MEDIA:……….",3768.0,,,Goku,390-47758-001,N/S,"PLACA,DENTADA - PTA CARGA, AC",Una de las placas tiene la ranura del lado contrario al indicado en el PI,CYD-007,,,,3768,VARIOS - (ANULAR DESPUES DE ACT.TABLA TALLERES),20 - 20
60317,Minos,9317,3141,,,Vigente c/disposición de CRP/CRM,20/12/2024,20/12/2024,,,,Marder III,Tiger II,Jamir,Elefant,53143199,240001,0.0,0,,,,,Goku,2265-0000-000,IL-001,ESTRUCTURA TREN PRINCIPAL IZQUIERDO,Extravío de documentación  de registro durante intervención del componente en cuestión con avance de tareas (#ref. RTI NRO AC-XQ-2265-0000-000-83-001G).,CYD-002,,,,3141,,
60318,Seiya,3768,403,,,Cerrado en Disposición,20/12/2024,03/01/2025,,,,Panzer IV,Panzer IV,Santuario,Panzer IV,41932104,755914,0.0,25,"DESANIDAR (Cortar micro-uniones) S/IPT/PAM/0826.
 RETIRAR EL EXCESO DE CONTORNO Y REBABAR  DE ACUERDO CON NE03-051 (NPF/PAM/008)
REALIZAR LIMPIEZA MANUAL S/NE40-012 (NPF/PRE/029 E IOP/PRE/0054). IDENTIFICAR CON ETIQUETA COLGANTE. S/ NPF/GER/006.
",405.0,,,Goku,PE12017-26_MF,24-26,PERFIL L,Se observa que falta C/U 1 pieza.,CYD-007,,,,405,CHAPA,24 - 26
60319,Seiya,3768,403,,,Cerrado en Disposición,20/12/2024,03/01/2025,,,,Panzer IV,Panzer IV,Santuario,Panzer IV,41932104,755939,0.0,25,"DESANIDAR (Cortar micro-uniones) S/IPT/PAM/0826.
 RETIRAR EL EXCESO DE CONTORNO Y REBABAR  DE ACUERDO CON NE03-051 (NPF/PAM/008)
REALIZAR LIMPIEZA MANUAL S/NE40-012 (NPF/PRE/029 E IOP/PRE/0054). IDENTIFICAR CON ETIQUETA COLGANTE. S/ NPF/GER/006.
",405.0,,,Goku,PE12017-28_MF,19-21,PERFIL L,Se observa que faltan C/U 3 piezas.,CYD-007,,,,405,CHAPA,19 - 21
60320,Seiya,3768,3748,,,Vigente c/disposición de CRP/CRM,21/12/2024,08/01/2025,,,,Panzer IV,Panzer IV,Santuario,Panzer IV,41932105,756374,0.0,10,"MECANIZAR EN FRESA CNC SEGUN PROGRAMAS, INSTRUCTIVO Y CROQUIS.

",310.0,,,Goku,390-15934-401_MF,22-22,"SOPORTE, ARNES","Se observa según plan de inspección, el faltaste de dos agujeros de tuercas ancladas que se detallan en la REF 12 y 13. Ademas los agujeros de la REF N1, con diámetro 2.5 (+0.25 -0) miden en C/U 2 piezas 3.11 mm.",AGU-003,,,,310,CONTROL NUMÉRICO,22 - 22
60321,Seiya,3768,3748,,,Vigente c/OTP,21/12/2024,08/01/2025,,,,Panzer IV,Panzer IV,Santuario,Panzer IV,41932104,751957,0.0,10,"MECANIZAR EN FRESA CNC SEGUN PROGRAMAS, INSTRUCTIVO Y CROQUIS.
IDENTIFICAR CON ETIQUETA COLGANTE SEGUN IPT-PAM-0492 METODO K.
IDENTIFICAR PIEZAS SEGUN CROQUIS CNC LADO 2
",310.0,,,Goku,390-47878-001,22-24,"BLOQUE RAD,RAMPA AUX,PTA CARGA,AL",Se fabricaron C/U 4 piezas 390-47878-002 y 2 piezas 390-47878-001,GYD-014,41932804.0,758512.0,60321.0,310,CONTROL NUMÉRICO,22 - 24
60322,Shiryu,3758,3748,,,Cerrado en Disposición,21/12/2024,02/01/2025,,,,Panzer IV,Panzer IV,Santuario,Panzer IV,41932105,753766,0.0,40,INSPECCIONAR SEGÚN PLAN DE INSPECCIÓN.,3748.0,,,Goku,391-58670-402_MF,19-19,"BISAGRA,TRASERA,DER-NLG,AL",De acuerdo a plan de insp. 391-58670-402_MF REV A las ref. 4-7-12-14 se encuentran fuera de tolerancia. Ver informe adjunto en red. \\Srie04in1\\mediciones 3d\\SALA DE MMC - PAM\\MEDICIONES\\KC 390\\391-58670-402_MF\\391-58670-402_MF-OTP753766,GYD-015,,,,3748,VARIOS - (ANULAR DESPUES DE ACT.TABLA TALLERES),19 - 19
60323,Shun,3748,3748,,,Interviene CRP/CRM,21/12/2024,,,,,Panzer IV,Panzer IV,Santuario,Panzer IV,41932105,752633,0.0,55,INSPECCIONAR SEGÚN PLAN DE INSPECCIÓN.,3768.0,,,Goku,390-47506-001_MF,20-2,"FRAME 23,HOOK 06-CARGO DOOR,AL",La pieza presenta espesores de pared en menor medida  (0.4 mm menos que el mínimo de la tolerancia) y algunos espesores de piso se encuentran en hasta 0.5 mm por encima del máximo de la tolerancia. Ver anexo adjunto.,GYD-006,,,,3768,VARIOS - (ANULAR DESPUES DE ACT.TABLA TALLERES),20 - 20
60324,Seiya,3768,3748,,,Vigente c/OTP,21/12/2024,03/01/2025,,,,Panzer IV,Panzer IV,Santuario,Panzer IV,41932104,748025,0.0,10,"MECANIZAR EN ROUTER CNC SEGUN PROGRAMA, INSTRUCTIVO Y CROQUIS.
IDENTIFICAR CON ETIQUETA COLGANTE SEGUN IPT-PAM-0492 METODO K.
",403.0,,,Goku,390-04119-001_MF1,23-23,"REFUERZO,CARENA MOVIL 4,FLAP-IZQ",Se observa segun el PI que se fabrico la pieza simetrica.,GYD-014,41932804.0,758082.0,60324.0,403,CHAPA,23 - 23
60325,Hyoga,3748,3748,,,Cerrado,21/12/2024,08/01/2025,,10/01/2025,10/01/2025,Panzer IV,Panzer IV,Santuario,Panzer IV,41932105,752252,0.0,10,"MECANIZAR EN FRESA CNC SEGUN PROGRAMAS, INSTRUCTIVO Y CROQUIS.
IDENTIFICAR CON ETIQUETA COLGANTE SEGUN IPT-PAM-0492 METODO K.
",310.0,,,Goku,390-57291-002_MF,N/S,"COSTILLA,CARENA MOVIL 3,FLAP-DER","Pieza 2 presenta REF 7; 9 y 11 fuera de tolerancia 
Pieza 5 y 6 presentan REF 9 fuera de tolerancia 
Las 6 piezas presentan resaltos de hasta 0.17 mm con radio 3 en pisos.",AGU-009,,,,310,CONTROL NUMÉRICO,21 - 26
60326,Seiya,3768,3748,,,Cerrado,21/12/2024,02/01/2025,,09/01/2025,09/01/2025,Panzer IV,Panzer IV,Santuario,Panzer IV,41932104,748027,0.0,10,"MECANIZAR EN ROUTER CNC SEGUN PROGRAMA, INSTRUCTIVO Y CROQUIS.
IDENTIFICAR CON ETIQUETA COLGANTE SEGUN IPT-PAM-0492 METODO K.
",403.0,,,Goku,390-56911-001_MF1,22-22,PLACA,"Se observa entrada de herramienta en zona de radio( indicado en la pieza) 11 mm de largo por 1 mm de ancho. Novedad recurrente, esta novedad se da por el grabado del numero de parte, por favor NO GRAVAR MAS EL NUMERO DE PARTE CON ROUTER CNC, ADEMAS IGUAL SE MEZCLAN LOS NCOTS! Ejemplificado en IMNC 60324. y otros muchos mas.",PAM-003,41932804.0,757995.0,60326.0,403,CHAPA,22 - 22
60327,Seiya,3768,416,,,Vigente c/OTP,22/12/2024,06/01/2025,,,,Panzer IV,Panzer IV,Santuario,Panzer IV,41932104,748362,0.0,45,ENMASCARAR ZONA DE  CONTACTO A MASA S/IOP/PIN/0024 E IPT/PIN/1027.,416.0,,,Goku,390-14346-404_MF,22-24,SOPORTE ELECTRICO,El contacto a masa de las tres piezas terminadas se encuentran desplazados. Fuera de tolerancia. C/U 3 piezas NO oK.,PIN-008,41932804.0,758114.0,60327.0,416,PROCESO QUIMÍCO,22 - 24
60328,Shun,3748,3748,,,Vigente c/OTP,22/12/2024,03/01/2025,,,,Panzer IV,Panzer IV,Santuario,Panzer IV,41932105,753764,0.0,40,"INSPECCIONAR SEGUN PLAN DE INSPECCION.
",3748.0,,,Goku,390-16807-403_MF,19-19,"CHARNELA, DELANTERA PUERTA, IZQ","El diámetro 25.4 mm se encuentra con marcas de herramienta y los chaflanes presentan ondulaciones. 
El nervio de 3 mm presenta entradas de herramienta y se observan espesores de 2.3 y 2.7 mm.",AGU-001,41932805.0,758098.0,60328.0,3748,VARIOS - (ANULAR DESPUES DE ACT.TABLA TALLERES),19 - 19
60329,Seiya,3768,404,,,Cerrado en Disposición,22/12/2024,03/01/2025,,,,Panzer IV,Panzer IV,Santuario,Panzer IV,41932105,756111,0.0,10,"
CONTORNEAR Y PERFORAR DE ACUERDO CON PROGRAMA DE CNC EN ROUTER DE 3 EJES, SEGÚN PLANTILLA DIGITAL.

",403.0,,,Goku,395-11621-003,23-25,BANDEJA,"Se observa en C/U 3 piezas, según REF 20 del PI que indica una distancia entre agujeros de 24.7 mm (TIP),se cumple para un solo par de agujeros, los siguientes 4 pares de agujeros están con una distancia entre centros de 21.7 mm.",AGU-009,,,,403,CHAPA,23 - 25
